{
  "schema_version": 1,
  "observer": "rendro-pdfjs-advisory",
  "advisory_boundary": "Pinned PDF.js advisory observation only; not GUI-viewer proof or Rendro runtime support.",
  "pdfjs_dist_version": "6.0.227",
  "node_version": "v22.14.0",
  "recorded_at": "2026-06-13T03:15:27.882Z",
  "platform": "darwin-arm64; Darwin 25.5.0",
  "fixture": "test/fixtures/embedded_artifact_support_fixture.pdf",
  "page_count": 2,
  "pages": [
    {
      "page_number": 1,
      "width": 612,
      "height": 792
    },
    {
      "page_number": 2,
      "width": 612,
      "height": 792
    }
  ],
  "warnings": [],
  "errors": []
}
